{"calibration_inventory":[{"case_id":"gate-c-000","sha256":"1a9ebe7c99b1135664a80b272de6b9123a04ffd6cbfc0e1ef90b9ccc06ed336c"},{"case_id":"gate-c-001","sha256":"ceac7ca01f4b4d5b482ddd2d6edea8490f909e63fbab3b56899e247b417a0540"},{"case_id":"gate-c-002","sha256":"25726bde34c527e2eda7e7b6110652db4b5987426d2192423c60e264f3d95ea0"},{"case_id":"gate-c-003","sha256":"3460fba21bfd5567f5477a680e435e98aaa042e1ca82e8a22cfd29774ec08c51"},{"case_id":"gate-c-004","sha256":"5f5c57115776ff4e5671f39aff62e5fe9f60dc1c6006cdc871c301a27c663e0e"},{"case_id":"gate-c-005","sha256":"5c57a305ad5c33659a82e032194c6caf5147ab2774de8c8d26bf2fdd67ecbbe7"},{"case_id":"gate-c-006","sha256":"47de8d58abf2497da32c935c124cc7e6c1431073292c3f9a6c3079092c6f3d51"},{"case_id":"gate-c-007","sha256":"9361256b0e2de63ce200c1a78b36a232eab2b54a7b8c5abb65dbf279efcb7318"},{"case_id":"gate-c-008","sha256":"a426f6c4e4f0dbe330a478b1ad4f5d816acef1bee769b799d0729250c70e003e"},{"case_id":"gate-c-009","sha256":"17f7c5a495a57a283a229e79dc71e786f25204e3e9ca66e1cec426d8bc10d3da"},{"case_id":"gate-c-010","sha256":"ad160a5f7dd6befcd076910c8d7f995965fc57793965369c2ccdc4ff8c77764f"},{"case_id":"gate-c-011","sha256":"b597c5115f6b183aa3a1cf48dd9fd248af4017f046c274717c9a666cd29af7b3"}],"calibration_sha256":"8e5c86656e7bd4e4ec9ab4f238c5c23fe0dfbc7f3fb0e183dac75a04b824d999","contract":{"evidence_scope":"demo","limits":{"alpha":0.05,"max_risk":0.05,"min_coverage":0.5},"name":"action-gate-triage","policy":{"allowed_labels":["billing","technical","sales"],"known_labels":["billing","technical","sales","other"],"threshold":0.9},"population":"Authored support-routing example for the application action gate; demo evidence only, no deployment, population or calibration claim","question":{"instructions":"Select the queue that should handle this ticket.","options":[{"description":"Payments, invoices and refunds","label":"billing"},{"description":"Errors, outages and technical support","label":"technical"},{"description":"Purchasing, quotes and plan questions","label":"sales"},{"description":"Anything else; a person chooses the queue","label":"other"}],"question_id":"queue"},"schema_version":1},"fault_inventory":[{"expected_action":"ESCALATE","kind":"timeout","scenario_id":"fault.timeout"},{"expected_action":"ESCALATE","kind":"rate_limit","scenario_id":"fault.rate_limit"},{"expected_action":"ESCALATE","kind":"malformed_response","scenario_id":"fault.malformed_response"},{"expected_action":"ESCALATE","kind":"identity_mismatch","scenario_id":"fault.identity_mismatch"},{"expected_action":"DENY","kind":"unknown_choice","scenario_id":"fault.unknown_choice"},{"expected_action":"ABSTAIN","kind":"low_confidence","scenario_id":"fault.low_confidence"}],"implementation_sha256":"a5fe090202f75b07510407937a86ae35a7653a75eab3f4daa2d0ace2e7641642","model_identity":{"adapter_version":"1","artifact_hashes":{"responses":"1727c540a6affcf44acbae95b74dc312c8acac05c9af59751bdd0bdcfbc195bb"},"model":"recorded-choice-v1","normalizer_version":"1","provider":"fixture","revision":"1727c540a6affcf44acbae95b74dc312c8acac05c9af59751bdd0bdcfbc195bb","runtime":{}},"replay_engine_version":"actseal-choice-v1","schema_version":2,"sha256":"cb009be0039afefd995f6eac3a8bd9767d6bf026a73273b47e87a51fc9fbd715","verification_cases":[{"case_id":"gate-v-000","expected_label":"billing","state":"Ticket GATE-V-000: I was charged twice for invoice 3000; please refund the duplicate."},{"case_id":"gate-v-001","expected_label":"technical","state":"Ticket GATE-V-001: The app crashes on launch since update 3001."},{"case_id":"gate-v-002","expected_label":"sales","state":"Ticket GATE-V-002: We need a quote for 3002 seats on the annual plan."},{"case_id":"gate-v-003","expected_label":"billing","state":"Ticket GATE-V-003: My refund for order 3003 has not arrived after cancellation."},{"case_id":"gate-v-004","expected_label":"technical","state":"Ticket GATE-V-004: Login returns error 3004 after a password reset."},{"case_id":"gate-v-005","expected_label":"sales","state":"Ticket GATE-V-005: Does plan 3005 include single sign-on for our team?"},{"case_id":"gate-v-006","expected_label":"billing","state":"Ticket GATE-V-006: The receipt for payment 3006 shows the wrong amount."},{"case_id":"gate-v-007","expected_label":"technical","state":"Ticket GATE-V-007: Export job 3007 never finishes and shows no progress."},{"case_id":"gate-v-008","expected_label":"sales","state":"Ticket GATE-V-008: Can we trial the enterprise tier before contract 3008 renews?"},{"case_id":"gate-v-009","expected_label":"billing","state":"Ticket GATE-V-009: Please update the card on file before invoice 3009 is due."},{"case_id":"gate-v-010","expected_label":"technical","state":"Ticket GATE-V-010: Notifications stopped arriving on device 3010."},{"case_id":"gate-v-011","expected_label":"sales","state":"Ticket GATE-V-011: What discount applies when ordering 3011 licences?"},{"case_id":"gate-v-012","expected_label":"billing","state":"Ticket GATE-V-012: I was charged twice for invoice 3012; please refund the duplicate."},{"case_id":"gate-v-013","expected_label":"technical","state":"Ticket GATE-V-013: The app crashes on launch since update 3013."},{"case_id":"gate-v-014","expected_label":"sales","state":"Ticket GATE-V-014: We need a quote for 3014 seats on the annual plan."},{"case_id":"gate-v-015","expected_label":"billing","state":"Ticket GATE-V-015: My refund for order 3015 has not arrived after cancellation."},{"case_id":"gate-v-016","expected_label":"technical","state":"Ticket GATE-V-016: Login returns error 3016 after a password reset."},{"case_id":"gate-v-017","expected_label":"sales","state":"Ticket GATE-V-017: Does plan 3017 include single sign-on for our team?"},{"case_id":"gate-v-018","expected_label":"billing","state":"Ticket GATE-V-018: The receipt for payment 3018 shows the wrong amount."},{"case_id":"gate-v-019","expected_label":"technical","state":"Ticket GATE-V-019: Export job 3019 never finishes and shows no progress."},{"case_id":"gate-v-020","expected_label":"sales","state":"Ticket GATE-V-020: Can we trial the enterprise tier before contract 3020 renews?"},{"case_id":"gate-v-021","expected_label":"billing","state":"Ticket GATE-V-021: Please update the card on file before invoice 3021 is due."},{"case_id":"gate-v-022","expected_label":"technical","state":"Ticket GATE-V-022: Notifications stopped arriving on device 3022."},{"case_id":"gate-v-023","expected_label":"sales","state":"Ticket GATE-V-023: What discount applies when ordering 3023 licences?"},{"case_id":"gate-v-024","expected_label":"billing","state":"Ticket GATE-V-024: I was charged twice for invoice 3024; please refund the duplicate."},{"case_id":"gate-v-025","expected_label":"technical","state":"Ticket GATE-V-025: The app crashes on launch since update 3025."},{"case_id":"gate-v-026","expected_label":"sales","state":"Ticket GATE-V-026: We need a quote for 3026 seats on the annual plan."},{"case_id":"gate-v-027","expected_label":"billing","state":"Ticket GATE-V-027: My refund for order 3027 has not arrived after cancellation."},{"case_id":"gate-v-028","expected_label":"technical","state":"Ticket GATE-V-028: Login returns error 3028 after a password reset."},{"case_id":"gate-v-029","expected_label":"sales","state":"Ticket GATE-V-029: Does plan 3029 include single sign-on for our team?"},{"case_id":"gate-v-030","expected_label":"billing","state":"Ticket GATE-V-030: The receipt for payment 3030 shows the wrong amount."},{"case_id":"gate-v-031","expected_label":"technical","state":"Ticket GATE-V-031: Export job 3031 never finishes and shows no progress."},{"case_id":"gate-v-032","expected_label":"sales","state":"Ticket GATE-V-032: Can we trial the enterprise tier before contract 3032 renews?"},{"case_id":"gate-v-033","expected_label":"billing","state":"Ticket GATE-V-033: Please update the card on file before invoice 3033 is due."},{"case_id":"gate-v-034","expected_label":"technical","state":"Ticket GATE-V-034: Notifications stopped arriving on device 3034."},{"case_id":"gate-v-035","expected_label":"sales","state":"Ticket GATE-V-035: What discount applies when ordering 3035 licences?"},{"case_id":"gate-v-036","expected_label":"billing","state":"Ticket GATE-V-036: I was charged twice for invoice 3036; please refund the duplicate."},{"case_id":"gate-v-037","expected_label":"technical","state":"Ticket GATE-V-037: The app crashes on launch since update 3037."},{"case_id":"gate-v-038","expected_label":"sales","state":"Ticket GATE-V-038: We need a quote for 3038 seats on the annual plan."},{"case_id":"gate-v-039","expected_label":"billing","state":"Ticket GATE-V-039: My refund for order 3039 has not arrived after cancellation."},{"case_id":"gate-v-040","expected_label":"technical","state":"Ticket GATE-V-040: Login returns error 3040 after a password reset."},{"case_id":"gate-v-041","expected_label":"sales","state":"Ticket GATE-V-041: Does plan 3041 include single sign-on for our team?"},{"case_id":"gate-v-042","expected_label":"billing","state":"Ticket GATE-V-042: The receipt for payment 3042 shows the wrong amount."},{"case_id":"gate-v-043","expected_label":"technical","state":"Ticket GATE-V-043: Export job 3043 never finishes and shows no progress."},{"case_id":"gate-v-044","expected_label":"sales","state":"Ticket GATE-V-044: Can we trial the enterprise tier before contract 3044 renews?"},{"case_id":"gate-v-045","expected_label":"billing","state":"Ticket GATE-V-045: Please update the card on file before invoice 3045 is due."},{"case_id":"gate-v-046","expected_label":"technical","state":"Ticket GATE-V-046: Notifications stopped arriving on device 3046."},{"case_id":"gate-v-047","expected_label":"sales","state":"Ticket GATE-V-047: What discount applies when ordering 3047 licences?"},{"case_id":"gate-v-048","expected_label":"billing","state":"Ticket GATE-V-048: I was charged twice for invoice 3048; please refund the duplicate."},{"case_id":"gate-v-049","expected_label":"technical","state":"Ticket GATE-V-049: The app c